{
  "schema_version": "1.0",
  "generated_at": "2026-08-11T12:00:00Z",
  "mock": true,
  "total_records": 3,
  "total_size_bytes": 868,
  "partition_count": 1,
  "default_partition": {
    "year": 2025,
    "month": 1
  },
  "partitions": [
    {
      "year": 2025,
      "month": 1,
      "path": "daily_trends/2025/01.json",
      "record_count": 3,
      "size_bytes": 868,
      "sha256": "72296587007d8a151df99b7cd78d959449488f956a1950d966f3c45a590ad94b"
    }
  ]
}
